{
  "contract_version": "1.0",
  "execution_mode": "simulated",
  "request_id": "22222222-2222-4222-8222-222222222222",
  "job_id": "11111111-1111-4111-8111-111111111111",
  "attempt": 1,
  "created_at": "2026-09-23T12:00:00Z",
  "requested_by": {
    "user_id": "33333333-3333-4333-8333-333333333333"
  },
  "pipeline": {
    "name": "Re3D",
    "tag": "re3d-pipeline-v1.1.3",
    "commit": "e517a161b4c0895f8be4258fb339272e4f99e1d6",
    "config_sha256": "9f8cbc83cb67b8313f624913686fbdc453e7572a18603d015bc198a9a92b8883"
  },
  "input": {
    "images_path": "input/images",
    "manifest_path": "input/input-manifest.json",
    "manifest_sha256": "aaaaaaaaaaaaaaaaaaaaaaaaaaaaaaaaaaaaaaaaaaaaaaaaaaaaaaaaaaaaaaaa",
    "image_count": 49,
    "total_bytes": 734003200
  },
  "branches": ["A-v4", "B-v2", "C"],
  "storage": {
    "work_path": "runtime/work",
    "logs_path": "runtime/logs",
    "output_path": "output",
    "reports_path": "reports",
    "manifests_path": "manifests"
  },
  "limits": {
    "timeout_seconds": 43200,
    "max_disk_bytes": 107374182400,
    "gpu_concurrency": 1
  },
  "idempotency_key": "bbbbbbbbbbbbbbbbbbbbbbbbbbbbbbbbbbbbbbbbbbbbbbbbbbbbbbbbbbbbbbbb"
}
